{
  "schema_scorecard_sessao": 2,
  "sessao_id": "024",
  "serie_avaliacao": "modules-v2",
  "status_avaliacao": "comprometida",
  "nota_geral_0a100": null,
  "faixa_geral": "comprometida",
  "eixos": {
    "calibracao": {
      "nota_0a100": 100.0,
      "peso": 30
    },
    "eficacia_integridade": {
      "nota_0a100": 77.58,
      "peso": 30
    },
    "confiabilidade": {
      "nota_0a100": 79.81,
      "peso": 20
    },
    "economia": {
      "nota_0a100": 74.11,
      "peso": 15
    },
    "fluidez": {
      "nota_0a100": 43.06,
      "peso": 5
    }
  },
  "componentes": {
    "economia": {
      "reducao_input_bruto": 100.0,
      "inferencias_por_turno": 71.43,
      "tools_por_turno": 83.33,
      "l0_l2_limpo": 41.67
    },
    "confiabilidade": {
      "par_cronica_exato": 66.67,
      "referencia_interacao_exatamente_uma_vez": 75.0
    }
  },
  "agregacao_modular": {
    "schema": 1,
    "status": "completa",
    "conclusao_permitida": true,
    "nota_parcial_componentes_validos": false,
    "modulos_catalogados": 12,
    "modulos_incluidos": 4,
    "modulos_bloqueados": [],
    "modulos_nao_avaliaveis": [
      {
        "module_id": "adversarial_operations",
        "motivo": "sem_atividade"
      },
      {
        "module_id": "canonical_quest_integration",
        "motivo": "sem_evidencia"
      },
      {
        "module_id": "causal_narrative_routing",
        "motivo": "nao_aplicavel"
      },
      {
        "module_id": "npc_continuity_and_social_behavior",
        "motivo": "evidencia_insuficiente"
      },
      {
        "module_id": "scene_world_projection",
        "motivo": "nao_aplicavel"
      },
      {
        "module_id": "sidequest_authoring",
        "motivo": "indeterminado"
      },
      {
        "module_id": "sidequest_lifecycle",
        "motivo": "nao_aplicavel"
      },
      {
        "module_id": "world_boundary_resolution",
        "motivo": "sem_evidencia"
      }
    ],
    "denominadores": {
      "calibracao": {
        "componentes_validos": 4,
        "module_ids": [
          "context_and_memory",
          "turn_and_session_orchestration",
          "narrative_delivery",
          "rules_and_character_state"
        ],
        "modulos_bloqueados_excluidos": []
      },
      "eficacia_integridade": {
        "componentes_validos": 4,
        "module_ids": [
          "context_and_memory",
          "turn_and_session_orchestration",
          "narrative_delivery",
          "rules_and_character_state"
        ],
        "modulos_bloqueados_excluidos": []
      },
      "confiabilidade": {
        "componentes_modulares_validos": 4,
        "module_ids": [
          "context_and_memory",
          "turn_and_session_orchestration",
          "narrative_delivery",
          "rules_and_character_state"
        ],
        "componentes_globais_validos": [
          "par_cronica_exato",
          "referencia_interacao_exatamente_uma_vez"
        ],
        "modulos_bloqueados_excluidos": []
      },
      "economia": {
        "componentes_globais_validos": [
          "reducao_input_bruto",
          "inferencias_por_turno",
          "tools_por_turno",
          "l0_l2_limpo"
        ]
      },
      "fluidez": {
        "componentes_globais_validos": [
          "latencia_sessao"
        ]
      },
      "nota_geral": {
        "eixos_validos": [
          "calibracao",
          "eficacia_integridade",
          "confiabilidade",
          "economia",
          "fluidez"
        ],
        "eixos_sem_evidencia": [],
        "pesos_renormalizados": true
      }
    },
    "regra": "componentes de módulos com falha de instrumentação são excluídos antes das médias; a nota restante é parcial e não autoriza conclusão"
  },
  "experiencia": {
    "recebidas": 13,
    "confirmadas": 8,
    "pendentes": 0,
    "pontuaveis": 8,
    "nao_pontuaveis": 5,
    "confirmadas_indeterminadas": 0,
    "criterios_pontuaveis": [
      "context_and_memory.knowledge_layer_separation",
      "narrative_delivery.narrative_density",
      "narrative_delivery.visible_closure",
      "npc_continuity_and_social_behavior.relationship_memory_reputation",
      "npc_continuity_and_social_behavior.social_initiative",
      "rules_and_character_state.roll_execution",
      "turn_and_session_orchestration.transactional_turn"
    ],
    "matriz_oportunidade": {
      "verdadeiro_positivo": 8,
      "verdadeiro_negativo": 0,
      "falso_positivo": 0,
      "falso_negativo": 0
    },
    "denominador_oportunidade": 8,
    "oportunidades_perdidas": 0,
    "nota_oportunidade_0a100": 100.0,
    "denominador_qualidade": 8,
    "qualidade_inadequada": 1,
    "nota_qualidade_0a100": 87.5,
    "nota_experiencia_0a100": null,
    "violacoes_guardrail": [
      "amv04-espera-nao-autorizada"
    ],
    "proveniencia_legada_nao_revalidada": 0,
    "revisoes_com_fontes_verificadas": 13
  },
  "natureza_nota_geral": "indicadores_operacionais_nao_confirmam_qualidade_da_experiencia",
  "filas_prioridade": {
    "schema": 1,
    "ranking_global_existe": false,
    "custo_e_experiencia_misturados": false,
    "reparo_medidor": {
      "module_ids": [],
      "regra": "somente falhas de instrumentação; severidade é a proporção de unidades obrigatórias afetadas"
    },
    "problemas_experiencia": {
      "module_ids": [
        "context_and_memory",
        "npc_continuity_and_social_behavior",
        "rules_and_character_state",
        "turn_and_session_orchestration"
      ],
      "regra": "somente qualidade por interação adjudicada; prioridade é 100 menos a nota de experiência"
    },
    "investigacao_custo": {
      "module_ids": [
        "context_and_memory",
        "narrative_delivery",
        "rules_and_character_state",
        "sidequest_authoring",
        "turn_and_session_orchestration",
        "npc_continuity_and_social_behavior",
        "scene_world_projection"
      ],
      "regra": "ordem por tokens atribuídos contabilmente; não infere custo causal",
      "causalidade_inferida": false
    }
  },
  "indicadores_globais": {
    "turnos_narrativos": 9,
    "interacoes_observadas": 12,
    "interacoes_com_referencia_exata": 9,
    "input_tokens": 5352780,
    "cached_input_tokens": 5086976,
    "uncached_input_tokens_aprox": 265804,
    "output_tokens": 54019,
    "reducao_input_bruto_baseline": 0.722955,
    "inferencias_por_turno": 7.0,
    "tools_por_turno": 6.0,
    "orquestracao_por_turno": 2.889,
    "fracao_par_cronica_exato": 0.666667,
    "fracao_l0_l2_limpo": 0.333333,
    "fracao_turnos_com_raw": 0.555556,
    "raw_read_calls": 12,
    "schema_discovery_calls": 2,
    "compactacoes": 0,
    "latencia_mediana_segundos": 146.789,
    "latencia_p90_segundos": 265.214,
    "latencia_maxima_segundos": 288.402,
    "turnos_acima_300_segundos": 0
  },
  "manifestacoes": {
    "total": 1,
    "confirmadas_ou_parciais": 1,
    "guardrails_confirmados": 0
  },
  "qualidade_interacao": {
    "avaliacoes_recebidas": 13,
    "avaliacoes_confirmadas": 8,
    "avaliacoes_pontuaveis": 8,
    "oportunidades_perdidas": 0,
    "modulos_com_nota_qualidade": 5,
    "regra": "somente adjudicações confirmadas com critério e evidência entram nos denominadores; conformidade operacional permanece separada"
  },
  "violacoes_criticas": [
    {
      "guardrail": "player_agency",
      "assessment_id": "amv04-espera-nao-autorizada",
      "interaction_ref": "S024-I0011",
      "module_id": "narrative_delivery"
    }
  ],
  "guardrails_participam_media": false,
  "confianca": {
    "sessao": "provisoria",
    "motivo": "estabilidade exige três sessões comparáveis e a amostra mínima por módulo"
  },
  "observacoes": [
    "N/D é excluído e os pesos restantes são renormalizados.",
    "Componentes de módulos bloqueados são excluídos antes de qualquer eixo ou nota geral.",
    "Manifestações do jogador são evidência adjudicada, nunca nota direta.",
    "Qualidade por interação exige critério e evidência adjudicados; conformidade operacional não a substitui.",
    "Reparo do medidor, problemas da experiência e investigação de custo usam filas independentes.",
    "Custo pai é atribuição contábil aditiva; não prova custo causal. Custo de subcapacidade é somente exposição."
  ],
  "conclusao_medicao": {
    "schema_conclusao_medicao": 1,
    "permitida": false,
    "entrada_congelada": true,
    "reproducao_verificada": true,
    "bloqueios": [
      {
        "codigo": "resultado_operacao_ausente",
        "operation_ids": [
          "01a0ad32-67f0-7e82-b319-d67aaf9fd520/call_csgPWubVnXvlMeUaYn8ap13a/0"
        ],
        "module_ids": [
          "context_and_memory",
          "narrative_delivery",
          "npc_continuity_and_social_behavior",
          "rules_and_character_state",
          "turn_and_session_orchestration"
        ]
      },
      {
        "codigo": "evidencia_operacional_insuficiente",
        "operation_ids": [
          "01a0aaca-8cb0-7bf2-aff8-e236a6c3b45d/call_66JS1RbDX7ktNtiy2COtQzso/0",
          "01a0aad7-f645-7691-9aca-8b00300da48c/call_Ff1iFEPlAQSyUM9w2ST6589P/0",
          "01a0aade-5b4e-7661-b38a-31ce71af1f2c/call_LVcXFxzolbGJFt4CAYKpAU3J/0",
          "01a0aaea-3809-7863-ae6b-8df5dc6f9272/call_gWXhPi9M5lQDq79jA7Bd1syG/0",
          "01a0aaf1-5dc5-7df1-a642-200c66832150/call_OL2BmHEieGb1yrYBk4OZuyjT/0",
          "01a0ab0f-2670-78c3-974d-851984849264/call_tgVYjtxsaoTPsFNkfoiKrQ3a/0",
          "01a0ab0f-2670-78c3-974d-851984849264/call_zXnAOyuW4tGfhmZcHKSCfCby/0"
        ],
        "module_ids": [
          "context_and_memory",
          "narrative_delivery",
          "npc_continuity_and_social_behavior",
          "rules_and_character_state",
          "turn_and_session_orchestration"
        ]
      }
    ],
    "limitacoes": [
      {
        "codigo": "evidencia_operacional_insuficiente",
        "escopo": "operacao:01a0aac8-baee-7d91-a05d-af084bc326de/call_qz4GGUoKTkHfvA8D1U44lHpB/0",
        "gravidade": "limitacao",